{
  "$schema": "../schemas/profile.schema.json",
  "channel_variants": [],
  "evidence": {
    "confidence": "medium",
    "level": "manual-backed",
    "note": null,
    "status": "seed"
  },
  "filename_patterns": [
    {
      "applies_to": [],
      "channels": {
        "F": "front",
        "PF": "parking_front",
        "PR": "parking_rear",
        "R": "rear"
      },
      "default_channel": null,
      "modes": {
        "PF": "parking",
        "PR": "parking"
      },
      "pattern": "^(\\d{4})(\\d{2})(\\d{2})(\\d{6})_(\\d+)(F|R|PF|PR)\\.MP4$",
      "timestamp_format": "YYYYMMDDHHMMSS"
    },
    {
      "applies_to": [],
      "channels": {
        "PF": "parking_front",
        "PR": "parking_rear"
      },
      "default_channel": null,
      "modes": {
        "PF": "parking",
        "PR": "parking"
      },
      "pattern": "^(\\d{4})_(\\d{4})_(\\d{6})_(PF|PR)\\.MP4$",
      "timestamp_format": "YYYY_MMDD_HHMMSS"
    }
  ],
  "id": "viofo-a129-plus-duo",
  "manufacturer": "VIOFO",
  "model": "A129 Plus Duo",
  "notes": [],
  "recording": {
    "driving_folders": [
      {
        "importable": true,
        "mode": "continuous",
        "notes": [],
        "path": "DCIM/Movie",
        "validation": "inferred"
      },
      {
        "importable": true,
        "mode": "protected",
        "notes": [],
        "path": "DCIM/Movie/RO",
        "validation": "inferred"
      }
    ],
    "other_folders": [],
    "parking_folders": [
      {
        "importable": true,
        "mode": "parking",
        "notes": [],
        "path": "DCIM/Movie/Parking",
        "validation": "inferred"
      }
    ],
    "parking_modes": [
      "parking"
    ]
  },
  "schema_version": "1.0",
  "sources": [
    {
      "kind": "research",
      "label": "Nas Dashcam Pattern Sampling 2026 06 06 research notes",
      "url": "https://github.com/vortexopenclaw/dashcam-offloader/blob/main/docs/research/nas-dashcam-pattern-sampling-2026-06-06.md"
    },
    {
      "kind": "manual",
      "label": "Official English user manual (PDF)",
      "url": "https://viofotech.com/download/manual/A129S/A129PlusEnglishManual.pdf"
    }
  ],
  "technical_facts": [],
  "video_samples": [
    {
      "bitrate": "~11.6-29.6 Mbps",
      "channel": "F (front)",
      "codec": "H.264",
      "container": "MP4",
      "fps": "30",
      "mode": "driving",
      "resolution": "2560x1440",
      "source": "ffprobe"
    },
    {
      "bitrate": "~18.4 Mbps",
      "channel": "R (rear)",
      "codec": "H.264",
      "container": "MP4",
      "fps": "30",
      "mode": "driving",
      "resolution": "1920x1080",
      "source": "ffprobe"
    },
    {
      "bitrate": "~8.4-9.8 Mbps",
      "channel": "PF",
      "codec": "H.264 / HEVC",
      "container": "MP4",
      "fps": "30",
      "mode": "parking",
      "resolution": "2560x1440",
      "source": "ffprobe"
    }
  ]
}
