{
  "$schema": "../schemas/profile.schema.json",
  "channel_variants": [
    {
      "channels": 2,
      "roles": [
        "front",
        "rear"
      ],
      "validation": "official_reference",
      "variant": null
    }
  ],
  "evidence": {
    "confidence": "medium",
    "level": "manual-backed",
    "note": "Official manual confirms folders, REC filename structure, F/R channels, and 2CH specifications. A real card is still needed for exact model metadata and unobserved filename prefixes.",
    "status": "seed"
  },
  "filename_patterns": [
    {
      "applies_to": [],
      "channels": {
        "F": "front",
        "R": "rear"
      },
      "default_channel": null,
      "modes": {},
      "pattern": "^REC_(\\d{8})_(\\d{6})_([FR])\\.MP4$",
      "timestamp_format": "YYYYMMDD_HHMMSS"
    }
  ],
  "id": "thinkware-arc-900",
  "manufacturer": "Thinkware",
  "model": "ARC 900",
  "notes": [],
  "recording": {
    "driving_folders": [
      {
        "importable": true,
        "mode": "continuous",
        "notes": [],
        "path": "cont_rec",
        "validation": null
      },
      {
        "importable": true,
        "mode": "driving_event",
        "notes": [],
        "path": "evt_rec",
        "validation": null
      },
      {
        "importable": true,
        "mode": "manual",
        "notes": [],
        "path": "manual_rec",
        "validation": null
      },
      {
        "importable": true,
        "mode": "sos",
        "notes": [],
        "path": "sos_rec",
        "validation": null
      }
    ],
    "other_folders": [],
    "parking_folders": [
      {
        "importable": true,
        "mode": "parking_motion_or_timelapse",
        "notes": [],
        "path": "motion_rec",
        "validation": null
      },
      {
        "importable": true,
        "mode": "parking_event",
        "notes": [],
        "path": "parking_rec",
        "validation": null
      }
    ],
    "parking_modes": [
      "parking_event",
      "parking_motion_or_timelapse"
    ]
  },
  "schema_version": "1.0",
  "sources": [
    {
      "kind": "research",
      "label": "Thinkware Arc 900 research notes",
      "url": "https://github.com/vortexopenclaw/dashcam-offloader/blob/main/docs/card-profiles/thinkware-arc-900.md"
    },
    {
      "kind": "manual",
      "label": "Official manual",
      "url": "https://download2.inavi.com/dashcam/ARC900/manual/arc900_manual_english_20251031.pdf"
    }
  ],
  "technical_facts": [],
  "video_samples": []
}
