{
  "$schema": "../schemas/profile.schema.json",
  "channel_variants": [
    {
      "channels": 2,
      "roles": [
        "front",
        "rear"
      ],
      "validation": "real_card_sampled",
      "variant": null
    }
  ],
  "evidence": {
    "confidence": "medium",
    "level": "manual-backed",
    "note": "One real 2-channel card-learning submission. Driving and G-sensor emergency clips are sampled; manual-event and parking behavior remain unverified.",
    "status": "experimental"
  },
  "filename_patterns": [
    {
      "applies_to": [],
      "channels": {},
      "default_channel": "front",
      "modes": {},
      "pattern": "^(\\d{4})_(\\d{2})_(\\d{2})_(\\d{6})_(\\d{2})\\.TS$",
      "timestamp_format": "YYYY_MM_DD_HHMMSS"
    },
    {
      "applies_to": [],
      "channels": {
        "b": "rear"
      },
      "default_channel": null,
      "modes": {},
      "pattern": "^(\\d{4})_(\\d{2})_(\\d{2})_(\\d{6})_(\\d{2})_b\\.TS$",
      "timestamp_format": "YYYY_MM_DD_HHMMSS"
    }
  ],
  "id": "ottocast-ottosafe-cam",
  "manufacturer": "Ottocast",
  "model": "OttoSafe Cam",
  "notes": [],
  "recording": {
    "driving_folders": [
      {
        "importable": true,
        "mode": "continuous",
        "notes": [],
        "path": "norm",
        "validation": null
      },
      {
        "importable": true,
        "mode": "continuous",
        "notes": [],
        "path": "back_norm",
        "validation": null
      },
      {
        "importable": true,
        "mode": "event",
        "notes": [],
        "path": "emr",
        "validation": null
      },
      {
        "importable": true,
        "mode": "event",
        "notes": [],
        "path": "back_emr",
        "validation": null
      }
    ],
    "other_folders": [
      {
        "importable": true,
        "mode": "photo",
        "notes": [],
        "path": "Photo",
        "validation": null
      }
    ],
    "parking_folders": [],
    "parking_modes": []
  },
  "schema_version": "1.0",
  "sources": [],
  "technical_facts": [
    {
      "label": "Complete-file driving storage front",
      "value": "2560x1440 at 29.97 fps: 16.983840-17.187423 Mbps including padding, audio and metadata. Full-length driving clips only. See docs/data/storage-evidence.json. Quality setting unconfirmed."
    },
    {
      "label": "Complete-file driving storage rear",
      "value": "1920x1080 at 25 fps: 9.098449-9.203283 Mbps including padding, audio and metadata. Full-length driving clips only. See docs/data/storage-evidence.json. Quality setting unconfirmed."
    },
    {
      "label": "Paired driving-file measurement archive",
      "value": "10 anonymous paired size/duration samples retained in docs/data/storage-evidence.json. Includes repeated scans and interrupted clips. Keep channel, format and recording-mode distinctions when deriving estimates."
    }
  ],
  "video_samples": []
}
