{
  "$schema": "../schemas/profile.schema.json",
  "channel_variants": [],
  "evidence": {
    "confidence": "not stated",
    "level": "manual-backed",
    "note": null,
    "status": "seed"
  },
  "filename_patterns": [
    {
      "applies_to": [
        "DCIM/Movie",
        "DCIM/Movie/RO",
        "DCIM/Movie/Parking"
      ],
      "channels": {},
      "default_channel": null,
      "modes": {},
      "pattern": "^(\\d{4})_(\\d{4})_(\\d{6})_(\\d+)(F|I|R|PF|PI|PR)\\.MP4$",
      "timestamp_format": "YYYY_MMDD_HHMMSS"
    },
    {
      "applies_to": [
        "DCIM/Photo"
      ],
      "channels": {},
      "default_channel": null,
      "modes": {},
      "pattern": "^(\\d{4})_(\\d{4})_(\\d{6})_(\\d+)(F|I|R|PF|PI|PR)\\.JPG$",
      "timestamp_format": "YYYY_MMDD_HHMMSS"
    }
  ],
  "id": "viofo-a229-plus",
  "manufacturer": "VIOFO",
  "model": "A229 Plus",
  "notes": [],
  "recording": {
    "driving_folders": [
      {
        "importable": true,
        "mode": "continuous",
        "notes": [
          "3 F/I/R triplets observed on real-card sample (fresh format). Parking, RO, and Photo subfolders not present on fresh card; created on first use."
        ],
        "path": "DCIM/Movie",
        "validation": "real_card_sampled"
      },
      {
        "importable": true,
        "mode": "protected",
        "notes": [
          "Not observed on fresh-card sample. Present on A229 Pro and A329S real-card samples; expected to follow identical structure."
        ],
        "path": "DCIM/Movie/RO",
        "validation": "inferred"
      }
    ],
    "other_folders": [
      {
        "importable": true,
        "mode": "still_image",
        "notes": [
          "Not observed on fresh-card sample. Present on A229 Pro and A329S real-card samples; expected to follow identical structure."
        ],
        "path": "DCIM/Photo",
        "validation": "inferred"
      }
    ],
    "parking_folders": [
      {
        "importable": true,
        "mode": "parking",
        "notes": [
          "Not observed on fresh-card sample. Present on A229 Pro and A329S real-card samples; expected to follow identical structure."
        ],
        "path": "DCIM/Movie/Parking",
        "validation": "inferred"
      }
    ],
    "parking_modes": [
      "parking"
    ]
  },
  "schema_version": "1.0",
  "sources": [
    {
      "kind": "research",
      "label": "Viofo A229 Plus research notes",
      "url": "https://github.com/vortexopenclaw/dashcam-offloader/blob/main/docs/card-profiles/viofo-a229-plus.md"
    },
    {
      "kind": "research",
      "label": "Viofo A229 Plus research notes",
      "url": "https://github.com/vortexopenclaw/dashcam-offloader/blob/main/docs/research/viofo-a229-plus.md"
    },
    {
      "kind": "source",
      "label": "Reference source",
      "url": "https://www.viofo.com/collections/dash-cam"
    },
    {
      "kind": "manual",
      "label": "Official English user manual (PDF)",
      "url": "https://viofotech.com/download/manual/A229S/A229PlusEnglishManual.pdf"
    }
  ],
  "technical_facts": [
    {
      "label": "resolutions \u203a F",
      "value": "2560x1440"
    },
    {
      "label": "resolutions \u203a I",
      "value": "1920x1080"
    },
    {
      "label": "resolutions \u203a R",
      "value": "2560x1440"
    },
    {
      "label": "resolutions \u203a validation",
      "value": "real_card_sampled"
    },
    {
      "label": "grouping \u203a keys",
      "value": "year"
    },
    {
      "label": "grouping \u203a keys",
      "value": "month_day"
    },
    {
      "label": "grouping \u203a keys",
      "value": "time"
    },
    {
      "label": "grouping \u203a expected_sets \u203a normal",
      "value": "F"
    },
    {
      "label": "grouping \u203a expected_sets \u203a normal",
      "value": "I"
    },
    {
      "label": "grouping \u203a expected_sets \u203a normal",
      "value": "R"
    },
    {
      "label": "grouping \u203a expected_sets \u203a parking",
      "value": "PF"
    },
    {
      "label": "grouping \u203a expected_sets \u203a parking",
      "value": "PI"
    },
    {
      "label": "grouping \u203a expected_sets \u203a parking",
      "value": "PR"
    }
  ],
  "video_samples": [
    {
      "bitrate": "~28.7 Mbps",
      "channel": "F (front)",
      "codec": "H.264",
      "container": "MP4",
      "fps": "30",
      "mode": "driving",
      "resolution": "2560x1440",
      "source": "ffprobe"
    },
    {
      "bitrate": "~23.8 Mbps",
      "channel": "R (rear)",
      "codec": "H.264",
      "container": "MP4",
      "fps": "30",
      "mode": "driving",
      "resolution": "2560x1440",
      "source": "ffprobe"
    },
    {
      "bitrate": "~15.6 Mbps",
      "channel": "I (interior)",
      "codec": "H.264",
      "container": "MP4",
      "fps": "30",
      "mode": "driving",
      "resolution": "1920x1080",
      "source": "ffprobe"
    }
  ]
}
